{
  "arrival_pattern": "closed_loop",
  "batch_size": 1,
  "concurrency": 1,
  "model_id": "smollm2-360m-instruct",
  "notes": "Generated by EdgeFlow using exact target-tokenizer buckets.",
  "output_tokens": 32,
  "prompt_source": {
    "name": "edgeflow-synthetic-v1",
    "revision": "1.0",
    "sample_ids_sha256": "09e306ff5a9b6c2e2c56e3f4b7da3b2906190c61a77a74916b47dd12b21ab709",
    "split": null,
    "type": "synthetic"
  },
  "prompt_tokens": 32,
  "quality_profile": "balanced",
  "request_rate": null,
  "sampling": {
    "ignore_eos": true,
    "strategy": "greedy",
    "temperature": 0.0,
    "top_k": null,
    "top_p": 1.0
  },
  "schema_version": "1.0",
  "seed": 42,
  "session_requests": 30,
  "streaming": true,
  "workload_id": "smoke-p32-o32-c1"
}
